{
  "$schema": "https://raw.githubusercontent.com/xsyetopz/go-mamusiabtw/refs/heads/main/schemas/plugin.schema.v1.json",
  "id": "info",
  "name": "Info",
  "version": "0.1.0",
  "permissions": {
    "storage": {
      "kv": true
    },
    "discord": {
      "users": true,
      "members": true,
      "guilds": true,
      "channels": true,
      "roles": true
    }
  }
}
