{
  "$schema": "https://raw.githubusercontent.com/xsyetopz/go-mamusiabtw/main/schemas/plugin.schema.v1.json",
  "id": "example",
  "name": "Example",
  "version": "0.0.1",
  "permissions": {
    "storage": {
      "kv": true
    }
  },
  "commands": [
    {
      "name": "example",
      "description": "Example Lua plugin command",
      "description_id": "cmd.example.desc",
      "ephemeral": true,
      "options": []
    }
  ]
}
